{
  "doc_id": "O2C-Milewood-IT-doc-09.06.25---JD-notes---HJ1-[516",
  "hierarchy_depth": 1,
  "depth_max": 1,
  "avg_blocks_per_section": 60.0,
  "root": {
    "children": [
      {
        "id": "c8ea33ff-38c0-49de-a7e6-4b218ad920ab",
        "ltu_id": "ltu_c8ea33ff-38c0-49de-a7e6-4b218ad920ab",
        "child_ids": [],
        "title": "Front Matter",
        "level": 1,
        "block_ids": [
          "24CE965E",
          "3213f88a-2558-4463-9972-e20a074d6506",
          "6f3e31f5-e848-4fb2-824b-15282084c5ca",
          "740247a1-1aa7-4d6b-bb5e-f3d4bbaefe9c",
          "3678adf2-34ea-478a-b148-75763046d04e",
          "77770590-1ee7-4081-9972-3e50bf7cb22e",
          "c47af0d9-b080-449c-a5b7-af30f3b20418",
          "45468273-619d-4f7c-88e3-262581a7c5b5",
          "ce36108d-3829-4178-871d-1c6a186af14c",
          "35e55414-c1d0-4c62-913f-d96575777a1d",
          "697b0ca9-89d5-41c8-b326-7d3b3f4c7b0a",
          "b21382a2-6ada-4caf-8bb2-63d256b98714",
          "779a998f-d206-4101-acdf-6a2a58a183bd",
          "1d0183f8-c84a-4228-b7e0-abd462a8354b",
          "4c1cc2b2-d873-4d3c-a341-79b237ee648c",
          "122b08bd-f520-4a24-adeb-003d2b262242",
          "c9729222-73df-41ab-8a93-b88365256f00",
          "ed1a85f1-80a8-41a1-b83f-04536271abea",
          "23db8f1b-3c17-4e93-95a6-da956c1aaf9d",
          "3eec278b-7cc3-4794-ad19-b4dd87c40095",
          "ea3a3418-1f3d-446c-a640-d190a8442b67",
          "72f1109e-c820-420e-af2f-63494dce017e",
          "f499b825-d701-4aca-a551-94346dd68a08",
          "df02bcf1-0a92-4d52-afc8-dad5f1b17916",
          "5726f8e4-3c3f-4df3-b980-457ba9b7dd82",
          "ea8fbaa2-fdcb-4b14-97ad-0cef977b9fb4",
          "6d58c674-59c0-4df9-a82e-320e224939d7",
          "38738f4b-365d-4382-941a-866b1483dbf7",
          "e72f419f-11bd-49a5-89b3-2a0f25757149",
          "0a3d81a7-7f13-4650-b294-89fa917d52eb",
          "4a5c6145-6aef-4f23-bc2d-719a7e67ec32",
          "29168d1c-963c-4129-af40-1b5128780826",
          "1db367f6-6e3b-4b07-a52c-15ca68329b27",
          "f88a79fa-0523-45ce-a5fd-9dacc6911d5b",
          "9033ef16-b4e9-4b8f-af03-b6854a6d7d33",
          "c34554c8-cbd3-462a-a0e1-77ca373735d0",
          "1b836099-5ff8-4912-a2b1-05524d95b248",
          "a3143b56-9ab3-475a-804b-671d4141ddc0",
          "cf32a3e2-d6fb-4341-a090-ed49b1c111f0",
          "c8862865-a6cd-4641-ae3b-5726322d45b4",
          "646cb4e3-fcf7-406b-9b87-a4ff7e70cff9",
          "96c2b60a-d2a0-4413-b949-f00ef1e43f9e",
          "71cbb247-a986-49dc-99f7-396d7fd7caa3",
          "ebaf8839-2baa-444d-884a-af2796829fab",
          "bb21b5f6-d675-4be3-8705-58b0ca874552",
          "005f17be-58dc-4751-9f4f-87a1eedc0b65",
          "c3cad47a-50f7-4e7a-a904-103b38ceb755",
          "4dabad0c-f489-4305-9791-e26529c48c98",
          "e0ffd427-8bd8-48c5-b811-21f83e72d5c9",
          "fdd1bfa7-371a-404d-b00f-5f2a68b7f843",
          "fa2604f8-78ef-45d1-a843-8903c5ff1d5c",
          "ecd45e84-eca3-4569-b1e3-a6354a6d3ee6",
          "373421d1-465e-416d-aa54-c81cd275e4f5",
          "4c5e0053-20a1-4adc-a318-826867ecb506",
          "2794f580-08ad-43b4-91b0-b67d3a37787d",
          "378fb355-a163-4729-98fc-2d7a658dbed4",
          "5f64e524-b100-4a5e-865e-cb433f8dd980",
          "3509579d-3c05-4fd6-82f4-4bd463f5687d",
          "a6609703-cb8f-4925-9d2e-446205952515",
          "860be61e-f78a-4fed-b584-61e9b52845db"
        ],
        "char_count": 15769,
        "children": [],
        "role": "front_matter",
        "attachment_id": null,
        "parent_id": null
      }
    ]
  }
}
