{
  "doc_id": "One2Call-Order---notes",
  "hierarchy_depth": 1,
  "depth_max": 1,
  "avg_blocks_per_section": 5.0,
  "root": {
    "children": [
      {
        "id": "0a4d1191-ed42-4275-bbfc-7b23f867d4f8",
        "ltu_id": "ltu_0a4d1191-ed42-4275-bbfc-7b23f867d4f8",
        "child_ids": [],
        "title": "Front Matter",
        "level": 1,
        "block_ids": [
          "63630C4D",
          "15E71DDC",
          "5E714DDF",
          "1C04A1CA",
          "78BF7688"
        ],
        "char_count": 448,
        "children": [],
        "role": "front_matter",
        "attachment_id": null,
        "parent_id": null
      }
    ]
  }
}
